{"$schema":"https://json-schema.org/draft/2020-12/schema","type":"object","additionalProperties":false,"required":["version","backend_image","frontend_image","neo4j_image","compose_sha256","targets"],"properties":{"version":{"type":"string","pattern":"^[a-zA-Z0-9._-]{1,64}$"},"backend_image":{"type":"string","pattern":"^ghcr.io/arvinhanye/smartsketch-backend@sha256:[a-f0-9]{64}$"},"frontend_image":{"type":"string","pattern":"^ghcr.io/arvinhanye/smartsketch-frontend@sha256:[a-f0-9]{64}$"},"neo4j_image":{"type":"string","pattern":"^neo4j@sha256:[a-f0-9]{64}$"},"compose_sha256":{"type":"string","pattern":"^[a-f0-9]{64}$"},"targets":{"type":"array","minItems":3,"maxItems":3,"uniqueItems":true,"items":{"enum":["darwin-arm64","darwin-amd64","windows-amd64"]}}}}
